tweet-id,timestamp,likes,replies,retweets,text
1081587898707697664,2019-01-05 16:27:04,0,0,0,"Google is working on it's next generation operating system #Fuchsia OS and now Google confirmed that it will support android apps. 
#androidupdate #techspandan"
1081234165788536833,2019-01-04 17:01:28,1,0,0,These are Redmi’s first phones after Xiaomi #android #androidupdate pic.twitter.com/mcAIeYohNR
1081211577683058688,2019-01-04 15:31:42,0,0,0,Huawei punishes staff for tweeting with iPhone #android #androidupdate pic.twitter.com/yezIZr3PN2
1080899392868106240,2019-01-03 18:51:12,1,0,0,Amazing foldable display phone demo leaked #android #androidupdate pic.twitter.com/6YBhsoGN3e
1080889327373172736,2019-01-03 18:11:12,0,0,1,Xiaomi spins off Redmi with first 48MP camera phone #android #androidupdate pic.twitter.com/BevBgqXAdj
1080878040941502464,2019-01-03 17:26:21,0,0,0,How Galaxy S10 uses the iPhone secret sauce in 2019 #android #androidupdate pic.twitter.com/d8w9YUVrCH
1080794946062483456,2019-01-03 11:56:09,1,0,0,Galaxy Note 8 to get Android 9 Pie earlier after all #android #androidupdate pic.twitter.com/M3anSMKIvv
1080705842519908352,2019-01-03 06:02:06,1,0,0,JerryRigEverything 2018 smartphone awards bode well for the industry #android #androidupdate pic.twitter.com/mpFR7cHYDQ
1080679216960675840,2019-01-03 04:16:18,0,0,0,Samsung foldable phone might have more cameras as well #android #androidupdate pic.twitter.com/MSiOJAZ8R5
1080667989723234304,2019-01-03 03:31:41,0,0,0,"Moto Z4 Play to come with waterdrop notch, Moto Mod pins #android #androidupdate pic.twitter.com/ZoHEJGfYFZ"
1080582327900819463,2019-01-02 21:51:17,2,0,1,Philips 4K TVs tap Android TV for CES 2019 #android #androidupdate pic.twitter.com/UdJmLKuTQz
1080538356696694784,2019-01-02 18:56:34,0,0,0,Galaxy S10 set for Samsung’s biggest release date ever #android #androidupdate pic.twitter.com/k5EseSh5pT
1080499279549091840,2019-01-02 16:21:17,0,0,0,Google Soli no-touch phone tech greenlit by FCC #android #androidupdate pic.twitter.com/siF4gQ1LxT
1080377405607497729,2019-01-02 08:17:00,0,1,0,"@SamsungMobile @SamsungMobileIN When are we going to get Android Pie update for S9+ in India?
#samsung #mobile #Android #androidupdate #india"
1080330406183034880,2019-01-02 05:10:15,0,0,0,"AOSMark tells which OEMs are best, worst at Android updates #android #androidupdate pic.twitter.com/kXoytNmOC0"
1080320397864812544,2019-01-02 04:30:28,1,0,0,"Galaxy S10+ case fits Galaxy S9+, OPPO Find X like a glove #android #androidupdate pic.twitter.com/VpcuFFzzr4"
1080309049990758401,2019-01-02 03:45:23,0,0,0,Vivo NEX Dual Display to get a cheaper version #android #androidupdate pic.twitter.com/7uJhFwZBpi
1080295199811751936,2019-01-02 02:50:21,0,0,0,Nokia 9 PureView could finally be HMD Global’s true flagship #android #androidupdate pic.twitter.com/zREXLCYi8h
1080268779710500864,2019-01-02 01:05:22,0,0,0,Essential is not dead but don’t get your hopes up #android #androidupdate pic.twitter.com/iei9O2zklC
1080178203673706497,2019-01-01 19:05:27,0,0,0,"In 2019, Galaxy S10 is the ballot #android #androidupdate pic.twitter.com/UD99xmpqws"
1080106465380179970,2019-01-01 14:20:23,0,0,0,Mobile in 2019: what our smartphones will be like #android #androidupdate pic.twitter.com/M43kGIbSfm
1079945879036018689,2019-01-01 03:42:16,0,0,0,My favorite thing about recently buying the unlocked @LGUS #g7thinq is that I don't have to worry about having an #androidupdate ruin my phone. Seems like I'm good for #2019. #lgg7 #androidpie
1087843497623851008,2019-01-22 22:44:35,0,0,0,"In 2019, consider no Galaxy S10 or iPhone XI #android #androidupdate pic.twitter.com/zi7QT026dL"
1087832094242426880,2019-01-22 21:59:16,0,0,0,"Target finally accepts Apple Pay, Google Pay, Samsung payments #android #androidupdate pic.twitter.com/22IL7sFGcP"
1087784271941718017,2019-01-22 18:49:15,0,0,0,Honor View 20 detailed: Here’s why it’s special #android #androidupdate pic.twitter.com/hxh6pTRDjt
1087742957128695808,2019-01-22 16:05:04,0,0,0,Vivo Apex 2019 may be the most beautiful phone ever #android #androidupdate pic.twitter.com/HjxYgglbvl
1087682601974808582,2019-01-22 12:05:15,2,0,0,"New #video is up!!!

Why OnePlus? OOS 5.0.8 update!?
https://youtu.be/A7kvXM4P4jI 
#oneplus #oneplus3 #oos #oxygenos #OnePlus6T @oneplus #Android #androidoreo #AndroidP #androidupdate #androidsecurity #YouTube #smallyoutubers #youtuberpic.twitter.com/v1bq8PuOQy"
1087667346859266048,2019-01-22 11:04:38,1,0,0,Galaxy S10 benchmarks lower than iPhone XS: why it doesn’t matter #android #androidupdate pic.twitter.com/RD1sa9ebRz
1087618455296200704,2019-01-22 07:50:21,0,0,2,Android Q Coming With Feature Allowing Carriers To SIM Lock Your Phone #Android #AndroidQ #AndroidUpdate #AndroidOShttps://www.gizmolad.com/2019/01/android-q-coming-with-features-that-allows-network-provider-sim-lock-your-phone/ …
1087569958111010816,2019-01-22 04:37:38,13,10,0,Not getting android 9 update on my OnePlus 5t @OnePlus_IN @OnePlus_Support #androidupdate #Android9
1087562769774317569,2019-01-22 04:09:04,0,0,0,"LG, Xiaomi, Huawei, Sony to fight for attention at MWC 2019 #android #androidupdate pic.twitter.com/E53IdZ1SPh"
1087545280902426626,2019-01-22 02:59:35,0,0,0,Galaxy S10 leak leaves little left for Samsung to announce #android #androidupdate pic.twitter.com/Xm7iLDG3AJ
1087525025278840832,2019-01-22 01:39:05,0,4,0,Android Q will offer carriers more power to lock down phones #android #androidupdate pic.twitter.com/KU6nsULJY4
1087414292289413120,2019-01-21 18:19:05,1,0,0,WhatsApp limits message forwarding to combat false information #android #androidupdate pic.twitter.com/RQG2EwPqSH
1087395622288850944,2019-01-21 17:04:53,0,0,0,Reddit’s best Android games of 2018 list is a bit of a shock #android #androidupdate pic.twitter.com/hn13ReyS9r
1087387966526406656,2019-01-21 16:34:28,0,0,0,Multiple RAZR 2019 foldable phones pop up in Motorola drawings #android #androidupdate pic.twitter.com/pwIFZsWEtT
1087377842889986048,2019-01-21 15:54:14,0,0,0,Spotify is now letting some users block artists #android #androidupdate pic.twitter.com/GIkaXI7tvg
1087304887724109824,2019-01-21 11:04:21,0,0,0,Galaxy S10 fingerprint on display confirmed by Samsung Pay #android #androidupdate pic.twitter.com/4aQ31wps8q
1087300669403328513,2019-01-21 10:47:35,0,0,0,This is @SamFirmware trying to get me to pay up. #cash #androidpie #Android9 #androidupdate #xda @xdadeveloperspic.twitter.com/jbH6SRW93R
1087213045988945926,2019-01-21 04:59:24,2,0,0,"Pixel 3, Pixel 3 XL are back to their Black Friday prices #android #androidupdate pic.twitter.com/Pyd9LOsJqz"
1087194123331883008,2019-01-21 03:44:12,0,0,0,Livermorium to make a slider phone after failing at a Moto Mod #android #androidupdate pic.twitter.com/wQqpWlMWA1
1087186593251700736,2019-01-21 03:14:17,0,0,0,Facebook Community Actions to let users make petitions for changes #android #androidupdate pic.twitter.com/twEsbeWy7S
1087170259436617728,2019-01-21 02:09:23,0,0,0,Action Launcher maker’s ActionDash brings Digital Wellbeing to all #android #androidupdate pic.twitter.com/TlNL1QmNQT
1087162734947549187,2019-01-21 01:39:29,1,0,0,Galaxy S10 could have “swipe to selfie” feature #android #androidupdate pic.twitter.com/6oLItUE3mi
1087151360859127809,2019-01-21 00:54:17,0,0,0,Huawei Mate 20 Pro ties with P20 Pro for top DxOMark spot #android #androidupdate pic.twitter.com/Gd9V2cIh3g
1086994126372044800,2019-01-20 14:29:29,0,0,0,See all 3 Galaxy S10 models in latest press image leak #android #androidupdate pic.twitter.com/bZLmKyhLxP
1086576338927058945,2019-01-19 10:49:21,0,0,0,"Good things are Coming to Android.

Credit - http://Xda-developers.com 
#AndroidQ #darktheme #android #desktopMode #Permission #revamp #androidupdate https://www.instagram.com/p/Bs0DkFbA-Wu/?utm_source=ig_twitter_share&igshid=11cv771n10hth …"
1086279141614268418,2019-01-18 15:08:24,0,0,0,I woke up to a new #androidupdate and now I feel like a dumb dumb. Who said to update my phone without asking? Where's my menu button?!
1086229043782004736,2019-01-18 11:49:19,1,0,0,Moto G7 series will come in fours before MWC 2019 #android #androidupdate pic.twitter.com/ARrGxtJ8qk
1086150997469261824,2019-01-18 06:39:12,0,0,0,LG G7 Android 9 Pie update rolls out with a surprise #android #androidupdate pic.twitter.com/5ClGRGCRgT
1086142440782868480,2019-01-18 06:05:12,1,0,0,"Sony Mobile in trouble, silently exiting Southeast Asia #android #androidupdate pic.twitter.com/9mWHBROxNZ"
1086118268019052544,2019-01-18 04:29:08,1,0,0,LG G8 renders show an unimpressive old design #android #androidupdate pic.twitter.com/SHoh9idB14
1086090621989937153,2019-01-18 02:39:17,1,0,0,Twitter Android bug made private tweets public for four years #android #androidupdate pic.twitter.com/QOiZgaqZZS
1086061650761998341,2019-01-18 00:44:10,0,0,0,LG to show phone with attachable second screen at MWC 2019 #android #androidupdate pic.twitter.com/ll6rRfyLFi
1086002600380694529,2019-01-17 20:49:31,4,0,1,"Nokia N9 reboot tipped, teased by Google #android #androidupdate pic.twitter.com/DO2t1XcOfc"
1085967351315607552,2019-01-17 18:29:27,0,0,0,Spotify Car View begins rolling out on Android today #android #androidupdate pic.twitter.com/X9Df9AW7rQ
1085930144810835968,2019-01-17 16:01:36,0,0,0,"Galaxy S10 units appear in real-world photos, testing #android #androidupdate pic.twitter.com/cqMV3Tl2EX"
1085922625950498816,2019-01-17 15:31:44,0,0,0,"Pixel 3 Lite leaks again, this time in hands-on video #android #androidupdate pic.twitter.com/601gzmL2OA"
1085786634392616960,2019-01-17 06:31:21,0,0,0,LG foldable phone will use two screens that merge into one #android #androidupdate pic.twitter.com/RODPVPZi86
1085762726633172995,2019-01-17 04:56:21,1,0,0,Xiaomi Mi Mix 3 durability test results are reassuring #android #androidupdate pic.twitter.com/nSAmP91R3G
1085736390338510849,2019-01-17 03:11:42,0,0,0,"Xiaomi teases more accurate, bigger fingerprint on display #android #androidupdate pic.twitter.com/pvY1PQsPQ9"
1085706123548729344,2019-01-17 01:11:25,0,0,0,Huawei could face US indictment for trade theft #android #androidupdate pic.twitter.com/MeIIKiJ5YD
1089197673364815872,2019-01-26 16:25:36,1,0,0,Who's gotten the #AndroidPie update in the US for #Samsung #S9? I'm on #Sprint network. Does that make a difference? All I can find is January release date. #Android #AndroidUpdate #SaturdayThoughts #SaturdayMorning
1088923451635707904,2019-01-25 22:15:56,0,0,0,Latest leaked LG G8 ThinQ renderings examined #android #androidupdate pic.twitter.com/eqFGPNST3Y
1088883017156837376,2019-01-25 19:35:16,0,0,0,Google IO 2019 conference details revealed in coded messages #android #androidupdate pic.twitter.com/cc4ExeBNMY
1088844269778096128,2019-01-25 17:01:18,0,0,0,Galaxy S10 event: All the Samsung devices we expect #android #androidupdate pic.twitter.com/Y81ynm1lhw
1088761284387131393,2019-01-25 11:31:33,0,0,0,I'm all pied up #androidupdate
1088757260187242496,2019-01-25 11:15:33,0,0,0,"Buttonless phones are gorgeous, but here are arguments against it #android #androidupdate pic.twitter.com/JqqNjGfyzv"
1088713078055845888,2019-01-25 08:19:59,0,0,0,"Thank you @AppleMusic for updating the android app with the bottom navigation bar.

#AppleMusic #AndroidUpdate"
1088669118637711362,2019-01-25 05:25:19,0,0,0,Galaxy A9 Pro (2019) is the global version of  Galaxy A8s outside of China #android #androidupdate pic.twitter.com/g7BQfu1feC
1088657895997218817,2019-01-25 04:40:43,0,0,0,Google Call Screen lets you eavesdrop on the conversation #android #androidupdate pic.twitter.com/TEGqcKabST
1088636501796241408,2019-01-25 03:15:42,0,0,0,Redmi Go is Xiaomi’s first Android Go phone #android #androidupdate pic.twitter.com/QUPCcmjEjp
1088620150289502208,2019-01-25 02:10:44,0,0,0,Huawei 5G phone at MWC 2019 will have two special features #android #androidupdate pic.twitter.com/7MPYxk1bLm
1088602622427365376,2019-01-25 01:01:05,0,0,0,Chromebook Instant Tether coming to non-Pixel Android phones in Chrome OS 73 #android #androidupdate pic.twitter.com/1In3JIeZEy
1088556027593850881,2019-01-24 21:55:56,0,0,0,Twitter tests Original Tweeter flair to stop conversation confusion #android #androidupdate pic.twitter.com/BJ7JVFhicP
1088530753623871490,2019-01-24 20:15:30,0,0,0,Facebook Moments is being killed off next month #android #androidupdate pic.twitter.com/WiuSnqQgIC
1088528279823437824,2019-01-24 20:05:40,0,0,0,First 5G Galaxy Fold release details spilled #android #androidupdate pic.twitter.com/bqNdzCKQuo
1088508091543502850,2019-01-24 18:45:27,0,0,0,Verizon’s Visible month-to-month plan hits Android today #android #androidupdate pic.twitter.com/HDTNIfVwVE
1088466456239656960,2019-01-24 16:00:00,0,0,0,Google already talking about Android Q. I just updated my phone to Android O (Oreo). #android #androidupdate pic.twitter.com/rXHLtvAZ1L
1088459079364808704,2019-01-24 15:30:41,0,0,0,Today’s Galaxy S10 photos show sharp details from all sides #android #androidupdate pic.twitter.com/6rIxgSQ8Ds
1088376132435697664,2019-01-24 10:01:05,0,0,0,Vivo APEX 2019 Super Unibody Concept Phone: the good and the bad #android #androidupdate pic.twitter.com/Xdc6iOi7HP
1088341815936380928,2019-01-24 07:44:43,1,0,0,Samsung Galaxy Note 8 Gets Second Android Pie Beta Update #Samsung #SamsungGalaxy #GalaxyNote8 #AndroidUpdate #Android9PieUpdate #AndroidPie #ANdroidhttps://www.gizmolad.com/2019/01/samsung-galaxy-note-8-gets-second-android-pie-beta-update/ …
1088289218139430917,2019-01-24 04:15:43,0,0,0,Moto G7 series details completely leaked by Motorola itself #android #androidupdate pic.twitter.com/GGJkHZtUtQ
1088281645323612160,2019-01-24 03:45:38,1,0,0,Huawei’s disappearing Twitter photos problem is less dramatic than you think #android #androidupdate pic.twitter.com/o8OpPhwc1I
1088265198341967872,2019-01-24 02:40:16,0,0,0,"LG 5G phone confirmed with big battery, vapor chamber inside #android #androidupdate pic.twitter.com/larVZT7Va0"
1088247719146201088,2019-01-24 01:30:49,2,0,0,Nokia Android 9 Pie update schedule revealed by HMD Global #android #androidupdate pic.twitter.com/xZKl0018dz
1088230681795280896,2019-01-24 00:23:07,2,0,1,Android is coming!!!!   We are just a few weeks away from our android release!!   Check back for more updates!  #androidupdate #android #RoamHr
1088206166247772161,2019-01-23 22:45:42,1,0,0,Galaxy F: You don’t want a foldable phone just yet #android #androidupdate pic.twitter.com/V664BH3er0
1088178373573206037,2019-01-23 20:55:16,1,0,0,How Galaxy S10 gives Bitcoin a boost in 2019 #android #androidupdate pic.twitter.com/uumbUiW7cR
1088112702709477376,2019-01-23 16:34:19,0,0,0,Polestar 2 Android-powered dashboard revealed – and a surprise #android #androidupdate pic.twitter.com/igjkQvx5OZ
1088071608688959488,2019-01-23 13:51:01,1,0,0,"Android Q rumors are taking rounds and people are actually guessing the name of the new OS!
http://bit.ly/2RbjBvM 
#android #androidp #androidpie #androidq #features #androidqrumors #androidupdate"
1087957983483572226,2019-01-23 06:19:31,1,0,0,Xiaomi double folding phone could steal Samsung’s thunder #android #androidupdate pic.twitter.com/Lz3hcBDARk
1087941566927392768,2019-01-23 05:14:17,1,0,0,"LG waves goodbye to touch, hello to 5G at MWC 2019 #android #androidupdate pic.twitter.com/ab4UFsuseZ"
1087910174323625984,2019-01-23 03:09:32,0,0,0,"Moto G7 photos, specs leaks tell all #android #androidupdate pic.twitter.com/zo2I9Utt8K"
1087891253973450755,2019-01-23 01:54:21,0,0,0,"Pixel 3, Galaxy Note 9 top new DxOMark selfie benchmarks #android #androidupdate pic.twitter.com/TXMsacDwt7"
1097604014521360391,2019-02-18 21:09:24,1,0,1,Android Q may have Pixel “pill” devour back button #android #androidupdate pic.twitter.com/rljHR2vJvk
1097564977551020032,2019-02-18 18:34:17,1,0,0,"All Galaxy S10 cases, covers leaked: Remember that screen issue? #android #androidupdate pic.twitter.com/ybo8kMfZZA"
1097549928350564358,2019-02-18 17:34:29,0,0,1,"Incognito Mode can be seen, but Google has a fix #android #androidupdate pic.twitter.com/7Ugrtr3qFb"
1097538656808718336,2019-02-18 16:49:41,1,0,0,"Need Galaxy S10 features, lower cost? See here: M30 #android #androidupdate pic.twitter.com/xIcg6aOdv9"
1097528473839640577,2019-02-18 16:09:13,1,0,0,"Pick your Galaxy S10 now: All the details, leaked and listed #android #androidupdate pic.twitter.com/geLY6T4qi0"
1097461804798828545,2019-02-18 11:44:18,1,0,0,"Android tablets are losing steam, Chrome OS to the rescue #android #androidupdate pic.twitter.com/En1wlR2Vqv"
1097445456253251585,2019-02-18 10:39:20,2,0,0,"Xiaomi Mi 9 features land days before debut, Explorer Edition included #android #androidupdate pic.twitter.com/UQ7ur00FOK"
1097363667627192320,2019-02-18 05:14:21,1,0,0,"LG V50 ThinQ 5G, G8 ThinQ confirmed to debut simultaneously #android #androidupdate pic.twitter.com/1JaOf4LOyJ"
1097344803786784768,2019-02-18 03:59:23,0,0,1,"Received the new system update on Vivo V11 Pro this morning. 
#vivo #vivov11pro #android #update #androidupdate pic.twitter.com/CUilURmv6r"
1097184390143246337,2019-02-17 17:21:57,0,0,0,Glad to see everyone else thinks the #androidupdate looks like trash. What is this?
1097097462752428033,2019-02-17 11:36:32,6,1,0,Am I the only one who thinks the latest S9 (Android) update makes my phone look like a cartoon now? What is wrong with the original theme and icons? Any way to revert it back? #samsungs9 #samsung #androidupdate #android #s9 #icons
1097006295381692416,2019-02-17 05:34:16,0,0,0,5G Moto Mod release gets FCC go-ahead – but it’s complicated #android #androidupdate pic.twitter.com/O3N8Bzfo0C
1096934344982171648,2019-02-17 00:48:22,0,1,1,"I finally got it!!! I can't wait!!! 

#samsungs9plus #samsung #android #android9 #androidpie9 #androidupdate #androidupdates https://www.instagram.com/p/Bt9p2PEFWUV/?utm_source=ig_twitter_share&igshid=1i20mddl3jhg3 …"
1096864443726622720,2019-02-16 20:10:36,0,2,0,"""Couldn't downloaded update, a network error occurred. "" 

#androidpie #android9 #androidupdate #galaxynote8"
1096806529603379200,2019-02-16 16:20:28,2,1,0,"Oh cool, an @android update. Guess I'll use the next hour or so to de-iPhone my Galaxy. #AndroidPie #androidupdate"
1096690358862389249,2019-02-16 08:38:51,1,0,0,This #androidupdate is extremely ugly!
1096525666533683204,2019-02-15 21:44:26,0,0,0,Android testing Google login-free app updating #android #androidupdate pic.twitter.com/5LkEey1A6B
1096511788156403712,2019-02-15 20:49:17,0,0,0,"Android ARCore update brings snapshot access, masks, patterns #android #androidupdate pic.twitter.com/IAg1hl1kVX"
1096485484975538177,2019-02-15 19:04:45,1,0,0,Good news: Smartphones last too long #android #androidupdate pic.twitter.com/YeG4KZxTLU
1096463207542140930,2019-02-15 17:36:14,0,1,1,"Yah, @Samsung's #GalaxyNote8 isn't getting @Google's #AndroidPie for several weeks yet. https://www.phonearena.com/news/samsung-galaxy-note-8-android-9-0-pie-update-stable-release_id113716 … #AndroidUpdate #Android9"
1096456426485149696,2019-02-15 17:09:17,0,0,0,"Android release of Stardew Valley finally in Google Play, sort of #android #androidupdate pic.twitter.com/tp60TXbuQV"
1096436354513334272,2019-02-15 15:49:32,0,0,0,Samsung Galaxy Tab S5e puts Bixby in a super-slim tablet #android #androidupdate pic.twitter.com/i6la02dgWq
1096435040660029446,2019-02-15 15:44:19,0,0,0,Nintendo Switch emulator released for Android #android #androidupdate pic.twitter.com/ldF8gnmext
1096287793817501696,2019-02-15 05:59:12,1,0,0,LEGO Hidden Side combines AR game with physical building sets #android #androidupdate pic.twitter.com/0yp7P5LKhM
1096270238105120769,2019-02-15 04:49:27,0,0,0,"Galaxy Fit tracker seen alongside Galaxy Buds, Galaxy Watch Active #android #androidupdate pic.twitter.com/WodF2lyRST"
1096260136170074112,2019-02-15 04:09:18,0,0,0,"Energizer Max P18K Pop has crazy big battery, dual pop up cameras #android #androidupdate pic.twitter.com/K72BHQX1aA"
1096222348506775552,2019-02-15 01:39:09,0,0,0,"Xperia L3 leaked with traditional, entry-level features #android #androidupdate pic.twitter.com/w2KImUIfSC"
1096209768375635974,2019-02-15 00:49:10,0,0,0,Samsung foldable phone patent is weird and might come next week #android #androidupdate pic.twitter.com/MVdNs89nwY
1096182122572697600,2019-02-14 22:59:18,0,0,0,Google Play Valentine’s Day code gives you a whole dollar #android #androidupdate pic.twitter.com/QwhrSGtdVU
1096166330858958849,2019-02-14 21:56:33,0,2,0,"What fucking idiots designed this #samsung #androidupdate ?
The clock has been on the right for YEARS, notifications left (can't find old screenshot so improvised..). Now I keep thinking I have a notification. 

I can't find a way to move clock back to right. 

Anyone know how? pic.twitter.com/Q2GjrH7EOn"
1096151941162455040,2019-02-14 20:59:22,1,0,0,Studies link smartphone radiation with demotivation #android #androidupdate pic.twitter.com/vxpYDZfydF
1096128419836907520,2019-02-14 19:25:55,2,0,2,Just downloaded the new @Samsung update for my S9. Absolutely horrible. All the buttons were enlarged for baby hands. Swiping left and right is now swiping up. It's like they are trying to mimic the iPhone. My battery is draining faster as well. #Android #androidupdate
1095923260376694784,2019-02-14 05:50:41,1,1,0,"As per recent news, Google found some insecure activities and decided to remove those photo editing apps which are spying the personal information from the phone.
https://dmguru.in/google-initiated-controlling-photo-apps-play-store.html …
#blogs by DM Guru
#googleupdates #androidupdate #digitalmarketingpic.twitter.com/H3SBeRukKN"
1095886385846935552,2019-02-14 03:24:09,0,0,0,Google Play Store 2018 security report is hopeful #android #androidupdate pic.twitter.com/ZkT19zIX2e
1095872655163645953,2019-02-14 02:29:35,1,0,0,"LG G8 ThinQ Crystal Sound uses OLED screen as speaker, amplifier #android #androidupdate pic.twitter.com/61TTIgNvt6"
1095851175415611392,2019-02-14 01:04:14,1,0,0,"Xperia XA3 to be called Xperia 10, hints at rebirth #android #androidupdate pic.twitter.com/bkpNjVileS"
1085655986537295872,2019-01-16 21:52:12,0,0,0,"First Android Q features revealed, including Dark Mode #android #androidupdate pic.twitter.com/rCXThYC6Aj"
1085629324353593346,2019-01-16 20:06:15,0,0,0,The foldable screen RAZR reboot has a rare opportunity #android #androidupdate pic.twitter.com/EL4qjYn6yf
1085619313548107776,2019-01-16 19:26:28,0,0,0,Galaxy S10’s secret weapon just leaked: Life Pattern #android #androidupdate pic.twitter.com/W8jPNobPIM
1085595421924298752,2019-01-16 17:51:32,0,0,0,PostmarketOS brings old Androids back to life with Linux #android #androidupdate pic.twitter.com/w4jX9u2pJF
1085589127502925824,2019-01-16 17:26:31,0,0,0,64-bit time: Old Android apps about to pull the plug #android #androidupdate pic.twitter.com/8SktTVdu8k
1085567794824077313,2019-01-16 16:01:45,1,0,0,Galaxy S8 Android Pie update appears with One UI Beta #android #androidupdate pic.twitter.com/rYa1vnST00
1085561431427346435,2019-01-16 15:36:28,0,0,0,Motorola RAZR could return as Verizon foldable smartphone #android #androidupdate pic.twitter.com/uwaGhndqah
1085560192912277505,2019-01-16 15:31:33,0,0,0,OPPO is bringing a 10x hybrid optical zoom camera to MWC #android #androidupdate pic.twitter.com/eX8dkCMXPR
1085494667351871488,2019-01-16 11:11:10,0,0,1,Snapdragon 855 benchmarks are starting to look impressive #android #androidupdate pic.twitter.com/skH4PWkN7Q
1085405406195789830,2019-01-16 05:16:29,0,0,0,"Huawei CEO praises trump, will fight Chinese government data request #android #androidupdate pic.twitter.com/bB3YHkxRGq"
1085363870896664578,2019-01-16 02:31:26,0,0,0,Twitter on Android finally gets the timeline right again #android #androidupdate pic.twitter.com/VfJf3hAKFP
1085250758369570827,2019-01-15 19:01:58,1,0,0,Pandora gets a voice assistant of its own today #android #androidupdate pic.twitter.com/llvftvmzth
1085231700857311232,2019-01-15 17:46:14,0,0,0,Nike Adapt BB shoes make Power Laces a reality #android #androidupdate pic.twitter.com/jcNjo1zDpz
1085222926633312257,2019-01-15 17:11:22,0,0,1,Galaxy S10 release date blues #android #androidupdate pic.twitter.com/tvf8IESjKB
1085190758028570625,2019-01-15 15:03:33,0,0,0,One UI based on Android Pie update is available for #galaxys9plus in India  #androidpie #pie #oneui #india #androidupdate pic.twitter.com/pdBoZ9JM4x
1085127526186393607,2019-01-15 10:52:17,0,0,0,"Google dropping Android apps who have no business reading SMS, call logs #android #androidupdate pic.twitter.com/Uv80mqn9A5"
1085118462744297472,2019-01-15 10:16:16,0,0,0,Easy phone to phone transfer with iSkysoft Toolbox – Switch #android #androidupdate pic.twitter.com/096vo2oVJX
1085044309907464192,2019-01-15 05:21:37,0,0,0,Galaxy M20 with Samsung’s first notch leaks out completely #android #androidupdate pic.twitter.com/aHOTVuApJS
1085026856938733569,2019-01-15 04:12:16,0,0,0,Google Fi pushing RCS next-gen SMS to compatible phones #android #androidupdate pic.twitter.com/E48Ykuop4K
1084997640746688512,2019-01-15 02:16:10,0,0,0,OPPO 10x hybrid optical zoom expected this week #android #androidupdate pic.twitter.com/KD7LPipaRY
1084983815444008961,2019-01-15 01:21:14,0,0,0,Galaxy S10 X 5G phone might be quite a beast #android #androidupdate pic.twitter.com/Cs3gg0jbv9
1084909600506343426,2019-01-14 20:26:20,0,0,0,Xiaomi Mi Mix 3 Review: Behold the Display Beast #android #androidupdate pic.twitter.com/0lKwkNYZK2
1084859401184399361,2019-01-14 17:06:51,1,0,0,OnePlus 7 leaks tips radical departure #android #androidupdate pic.twitter.com/mbmzSRs5nL
1084753112961671175,2019-01-14 10:04:30,12,3,1,"@Flipkart @XiaomiIndia Did u fooled ur customers? I don't see your description which had earlier mentioned Android 8.1 Oreo/Chromecast update for old Mi TVs 4A. Was that a marketing gimmick??
#MiTV #androidupdate ndroidupdate #flipkartfoolspic.twitter.com/Yx1partFUz"
