tweet-id,timestamp,likes,replies,retweets,text
1119288713484341248,2019-04-19 17:16:39,0,0,0,"Samsung S8, S9, S10, Note vital updates: Here’s what’s new today #android #androidupdate pic.twitter.com/mcTJBr7XIa"
1119089767402991617,2019-04-19 04:06:06,2,0,1,Pixel 3a and 3a XL renders won’t win design awards #android #androidupdate pic.twitter.com/THxwGazKnI
1119069491298750465,2019-04-19 02:45:32,1,0,0,LG V40 ThinQ DxOmark camera score spells trouble for the company #android #androidupdate pic.twitter.com/sUsl9not79
1119060669234581505,2019-04-19 02:10:29,0,0,0,Galaxy S10 Night Mode could give Samsung a small photography leg up #android #androidupdate pic.twitter.com/2LQnc9iWIM
1119044222164848640,2019-04-19 01:05:08,0,0,0,Google starts asking Android users in Europe which browser they want #android #androidupdate pic.twitter.com/6KBy77IYC7
1118991464158113793,2019-04-18 21:35:29,0,0,0,"Facebook Clear History tool: One button, no show #android #androidupdate pic.twitter.com/R54MI1sKv8"
1118980098391183363,2019-04-18 20:50:19,1,0,0,Pokemon GO shiny egg list just blew up for Easter #android #androidupdate pic.twitter.com/3TCXbgMEYz
1118918800861204481,2019-04-18 16:46:45,0,0,0,Fans share new Star Wars 9 wallpapers and images galore #android #androidupdate pic.twitter.com/pH73Feuwl2
1118903641979727874,2019-04-18 15:46:31,0,0,0,"HP Chromebook 15 2019: Finally, the age of couch apps is here #android #androidupdate pic.twitter.com/4Ce0rVFZr1"
1118883821137616901,2019-04-18 14:27:45,0,0,0,"Argh, I re-paired my phone, but it disconnected within a mile, mid-sentence in an @audible_com book!
#Android #androidupdate #androidpie #Subaru #samsungnote8 #note8 @subaru_usa @SamsungSupport"
1118870879679782912,2019-04-18 13:36:19,0,0,0,"@LGUSAMobile Whatever happened to your fabled ""Software Upgrade Center""? Your lack of display quality, support, and (multiple) device updates is laughable. This LG device is my last LG device. #LG #android #Updates #androidupdate"
1118866375148232704,2019-04-18 13:18:26,0,0,0,"@LGUS Whatever happened to your fabled ""Software Upgrade Center""? Your lack of display quality, support, and (multiple) device updates is laughable. This LG device is my last LG device. #LG #android #Updates #androidupdate"
1118865607703891968,2019-04-18 13:15:23,0,1,0,"Also since the latest #androidupdate #androidpie  I keep getting #sendingfailed #email errors, ""not connected to a network"" when I am 100% absolutely connected to my home #wifi. @xfinity @comcastcares
Gonna go restart the router again. Hope @AndroidDev fixes this soon!"
1118761778199060480,2019-04-18 06:22:48,0,0,0,Download J330GDXS3BSC2 Galaxy J3 Pro SM-J330G TNZ New zealandhttps://www.galaxyrom.com/firmware/download-j330gdxs3bsc2-galaxy-j3-pro-sm-j330g-tnz-new-zealand.html …
1118761514666790913,2019-04-18 06:21:45,0,0,0,Download A530FXXU4CSC6 Galaxy A8 SM-A530F BGL Bulgariahttps://www.galaxyrom.com/firmware/download-a530fxxu4csc6-galaxy-a8-sm-a530f-bgl-bulgaria.html …
1118760718554337280,2019-04-18 06:18:35,0,0,0,Download A720FXXU7CSC4 Galaxy A7 2017 (SM-A720F) SM-A720F ZTM Brazil (tim)https://www.galaxyrom.com/firmware/download-a720fxxu7csc4-galaxy-a7-2017-sm-a720f-sm-a720f-ztm-brazil-tim.html …
1118756644920483841,2019-04-18 06:02:24,0,0,0,Download J810FJXS3ASD1 Galaxy J8 (SM-J810F) SM-J810F CAU N/ahttps://www.galaxyrom.com/firmware/download-j810fjxs3asd1-galaxy-j8-sm-j810f-sm-j810f-cau-na.html …
1118755886653214720,2019-04-18 05:59:23,0,0,0,Download G955FXXU4DSCB Galaxy S8 Plus SM-G955F O2U United kingdom (o2)https://www.galaxyrom.com/firmware/download-g955fxxu4dscb-galaxy-s8-plus-sm-g955f-o2u-united-kingdom-o2.html …
1118755886091075584,2019-04-18 05:59:23,0,0,0,Download G965USQS4CSC8 Galaxy S9 Plus (SM-G965U) SM-G965U BST Boost mobilehttps://www.galaxyrom.com/firmware/download-g965usqs4csc8-galaxy-s9-plus-sm-g965u-sm-g965u-bst-boost-mobile.html …
1118754751863304195,2019-04-18 05:54:52,0,0,0,Download J727SKSU3BSC4 SM-J727S SM-J727S SKC N/ahttps://www.galaxyrom.com/firmware/download-j727sksu3bsc4-sm-j727s-sm-j727s-skc-na.html …
1118747810868817921,2019-04-18 05:27:18,0,0,0,Download A730FXXU4CSCN Galaxy A8 Plus SM-A730F TTT Trinidad and tobagohttps://www.galaxyrom.com/firmware/download-a730fxxu4cscn-galaxy-a8-plus-sm-a730f-ttt-trinidad-and-tobago.html …
1118742216409866240,2019-04-18 05:05:04,0,0,0,Download G965FXXU2CSC8 Galaxy S9 Plus (SM-G965F) SM-G965F TNZ New zealandhttps://www.galaxyrom.com/firmware/download-g965fxxu2csc8-galaxy-s9-plus-sm-g965f-sm-g965f-tnz-new-zealand.html …
1118742215776505857,2019-04-18 05:05:04,0,0,0,Download N950FXXS5DSC5 Galaxy Note 8 (SM-N950F) SM-N950F CHO Chilehttps://www.galaxyrom.com/firmware/download-n950fxxs5dsc5-galaxy-note-8-sm-n950f-sm-n950f-cho-chile.html …
1118742214384017409,2019-04-18 05:05:03,0,0,0,Download T719XXU2BSA1 Galaxy Tab S2 VE 8.0 LTE SM-T719 DBT Germanyhttps://www.galaxyrom.com/firmware/download-t719xxu2bsa1-galaxy-tab-s2-ve-8-0-lte-sm-t719-dbt-germany.html …
1118732164810641409,2019-04-18 04:25:07,0,0,0,Galaxy Fold protective film critical to keeping screen intact #android #androidupdate pic.twitter.com/O5aVJSaHwV
1118704522644217857,2019-04-18 02:35:17,0,0,0,Razer Phone 2 in Satin Black available as an online store exclusive #android #androidupdate pic.twitter.com/NpXL1iWZY2
1118688165215252481,2019-04-18 01:30:17,0,0,0,Galaxy Buds update brings Bixby voice control and improved gestures #android #androidupdate pic.twitter.com/DeJRBbQe5R
1118679420774993921,2019-04-18 00:55:32,0,0,0,Huawei P30 Pro iFixit teardown reveals interesting design choices #android #androidupdate pic.twitter.com/6RfpljEGGJ
1118632943969292288,2019-04-17 21:50:51,0,0,0,About OnePlus 7 Pro’s super speedy new screen #android #androidupdate pic.twitter.com/wo8nsnNyoq
1118585893793693702,2019-04-17 18:43:54,0,0,0,Download N960USQS1CSD1 SM-N960U SM-N960U SPR U.s. (spint)https://www.galaxyrom.com/firmware/download-n960usqs1csd1-sm-n960u-sm-n960u-spr-u-s-spint.html …
1118582482876682241,2019-04-17 18:30:20,0,0,0,Aaaaargh #androidupdate #androidpie what's up with crazy battery and data usage?! Not cool.
1118578179533234176,2019-04-17 18:13:14,0,0,0,Download J810YDXU2ASC5 SM-J810Y SM-J810Y VNZ New zealand (vodafone)https://www.galaxyrom.com/firmware/download-j810ydxu2asc5-sm-j810y-sm-j810y-vnz-new-zealand-vodafone.html …
1118576787364163585,2019-04-17 18:07:42,0,0,0,Download G960USQS4CSC8 Galaxy S9 (SM-G960U) SM-G960U SPR U.s. (spint)https://www.galaxyrom.com/firmware/download-g960usqs4csc8-galaxy-s9-sm-g960u-sm-g960u-spr-u-s-spint.html …
1118575157235331072,2019-04-17 18:01:14,0,0,0,Google Play budget tries to control your spending habits #android #androidupdate pic.twitter.com/3LIMjETnkd
1118571575127748611,2019-04-17 17:47:00,0,0,0,Download A605FNXXU3BSC6 SM-A605FN SM-A605FN ROM Romaniahttps://www.galaxyrom.com/firmware/download-a605fnxxu3bsc6-sm-a605fn-sm-a605fn-rom-romania.html …
1118571566479048706,2019-04-17 17:46:58,0,0,0,Download G960USQS4CSC8 Galaxy S9 (SM-G960U) SM-G960U BST Boost mobile https://www.galaxyrom.com/firmware/download-g960usqs4csc8-galaxy-s9-sm-g960u-sm-g960u-bst-boost-mobile.html …
1118567295884959745,2019-04-17 17:29:59,0,0,0,"Your #AndroidPhone is the  to protecting your identity. You can keep your accounts #Safe from #Phishing: https://hubs.ly/H0hv5Z70 
https://hubs.ly/H0hv6nx0 
#SecurityKey #AccountSecurity #AndroidUpdate
@Androidheadline @AndroidPolice @Android @TheAndroidSite @TalkAndroid"
1118565833079390208,2019-04-17 17:24:11,0,0,0,Download T360XXS1BRH3 Galaxy Tab Active (WiFi) SM-T360 XEF Francehttps://www.galaxyrom.com/firmware/download-t360xxs1brh3-galaxy-tab-active-wifi-sm-t360-xef-france.html …
1118563207910690818,2019-04-17 17:13:45,0,0,0,Download J250MUBS5ASD2 Galaxy J2 PRO SM-J250M TCE Mexicohttps://www.galaxyrom.com/firmware/download-j250mubs5asd2-galaxy-j2-pro-sm-j250m-tce-mexico.html …
1118563202613358593,2019-04-17 17:13:44,0,0,0,Download A510MUBS7CSC6 SM-A510M SM-A510M CGU Colombiahttps://www.galaxyrom.com/firmware/download-a510mubs7csc6-sm-a510m-sm-a510m-cgu-colombia.html …
1118503352940281857,2019-04-17 13:15:54,0,0,0,Anker Roav Bolt Review: An easy Google Assistant upgrade for your car #android #androidupdate pic.twitter.com/BF67UiSflu
1118474216993636352,2019-04-17 11:20:08,0,0,0,Download A530FXXU4CSC6 Galaxy A8 SM-A530F BTU United kingdomhttps://www.galaxyrom.com/firmware/download-a530fxxu4csc6-galaxy-a8-sm-a530f-btu-united-kingdom.html …
1118474216221880326,2019-04-17 11:20:08,0,0,0,Download M205FDDU1ASD1 SM-M205F SM-M205F INS Indiahttps://www.galaxyrom.com/firmware/download-m205fddu1asd1-sm-m205f-sm-m205f-ins-india.html …
1118474214032531457,2019-04-17 11:20:07,0,0,0,Download A920FXXU1BSC5 SM-A920F SM-A920F ECO Ecuador (claro)https://www.galaxyrom.com/firmware/download-a920fxxu1bsc5-sm-a920f-sm-a920f-eco-ecuador-claro.html …
1118474213696909312,2019-04-17 11:20:07,0,0,0,Download G950FXXU4DSCB Galaxy S8 SM-G950F H3G United kingdomhttps://www.galaxyrom.com/firmware/download-g950fxxu4dscb-galaxy-s8-sm-g950f-h3g-united-kingdom.html …
1118474212736421889,2019-04-17 11:20:07,0,0,0,Download J330GDXS3BSC2 Galaxy J3 Pro SM-J330G VFJ N/ahttps://www.galaxyrom.com/firmware/download-j330gdxs3bsc2-galaxy-j3-pro-sm-j330g-vfj-na.html …
1118474118666563584,2019-04-17 11:19:44,0,0,0,Download J330GDXS3BSC2 Galaxy J3 Pro SM-J330G XNZ N/a https://www.galaxyrom.com/firmware/download-j330gdxs3bsc2-galaxy-j3-pro-sm-j330g-xnz-na.html …
1118474117437640707,2019-04-17 11:19:44,0,0,0,Download G960USQS4CSC8 Galaxy S9 (SM-G960U) SM-G960U XAS Sprint (usa)https://www.galaxyrom.com/firmware/download-g960usqs4csc8-galaxy-s9-sm-g960u-sm-g960u-xas-sprint-usa.html …
1118474115768311810,2019-04-17 11:19:44,0,0,0,Download J810YDXU2ASC5 SM-J810Y SM-J810Y NZC New zelandhttps://www.galaxyrom.com/firmware/download-j810ydxu2asc5-sm-j810y-sm-j810y-nzc-new-zeland.html …
1118462992373506048,2019-04-17 10:35:32,0,0,0,@SamsungMobileUS @SamsungUS @SamsungSupport if I wanted my videos/ photos to look like an iphone's I would have bought an Iphone. This new update is #GARBAGE! Bring back the pro mode video/ photo functions! #Samsung #samsungupdate #androidpie #androidupdate #SamsungEvent
1118460963450163200,2019-04-17 10:27:28,1,0,0,"@SamsungMobileUS @SamsungSupport
I bought my phone for its superb video/photo quality using PRO functionality which is RUINED by this HORRIBLE new #androidupdate! The  lowlight vid/photo management is gone! This camera SUCKS! PLEASE UNDO! #SamsungEvent #samsungupdate #androidpie"
1118459678445510656,2019-04-17 10:22:21,1,0,0,Exactly. I'm about to do that too . #androidupdate
1118459143860387840,2019-04-17 10:20:14,0,0,0,Pixel 3 Photobooth uses AI to automatically take selfies #android #androidupdate pic.twitter.com/jH0tlld4QE
1118453321675825153,2019-04-17 09:57:06,2,0,0,@SamsungMobileUS @SamsungUS  if I wanted my videos to look like an iphone's I would have bought an Iphone. This new camera update SUCKS! Bring back the pro mode video function! #Samsung #samsungupdate #androidpie #androidupdate #SamsungEvent
1118370453058400259,2019-04-17 04:27:48,0,0,0,Download N960U1UEU1CSC2 Galaxy Note 9 (SM-N960U1) SM-N960U1 BST Boost mobilehttps://www.galaxyrom.com/firmware/download-n960u1ueu1csc2-galaxy-note-9-sm-n960u1-sm-n960u1-bst-boost-mobile.html …
1118370441821921280,2019-04-17 04:27:46,0,0,0,Download A605GNUBU3BSC6 SM-A605GN SM-A605GN EON N/ahttps://www.galaxyrom.com/firmware/download-a605gnubu3bsc6-sm-a605gn-sm-a605gn-eon-na.html …
1118370293343563777,2019-04-17 04:27:10,0,0,0,Download J810MUBU2BSD3 SM-J810M SM-J810M ZTO Brazilhttps://www.galaxyrom.com/firmware/download-j810mubu2bsd3-sm-j810m-sm-j810m-zto-brazil.html …
1118370292815007745,2019-04-17 04:27:10,0,0,0,Download T813XXU2BSB1 Galaxy Tab S2 VE 9.7 WiFi SM-T813 MXO N/a https://www.galaxyrom.com/firmware/download-t813xxu2bsb1-galaxy-tab-s2-ve-9-7-wifi-sm-t813-mxo-na.html …
1118370291770695680,2019-04-17 04:27:10,0,0,0,Download T813XXU2BSB1 Galaxy Tab S2 VE 9.7 WiFi SM-T813 CHO Chilehttps://www.galaxyrom.com/firmware/download-t813xxu2bsb1-galaxy-tab-s2-ve-9-7-wifi-sm-t813-cho-chile.html …
1118354685289803776,2019-04-17 03:25:09,0,0,0,LG V50 ThinQ launch delay blamed on 5G #android #androidupdate pic.twitter.com/pWHtbX8wYj
1118338380490858496,2019-04-17 02:20:22,0,0,0,Pixel Android Q system updates are coming via Google Play Store #android #androidupdate pic.twitter.com/UDdz4mXf7B
1118334016132927488,2019-04-17 02:03:01,1,0,2,"Uuggghhh please fix this awful ugly update that's fighting with so many things!! #android @AndroidDev
#androidupdate
The worst is how it keeps unpairing with my car.  @subaru_usa  waaaah #androidpie #samsungnote8 #note8"
1118323246452101120,2019-04-17 01:20:14,0,0,0,Galaxy S10 5G ties with Huawei P30 Pro on DxOMark but has some perks #android #androidupdate pic.twitter.com/ClulBEvLyw
1118311963124273152,2019-04-17 00:35:23,0,0,0,OnePlus 7 and OnePlus 7 Pro differences detailed #android #androidupdate pic.twitter.com/oL4EQHDA93
1118308125956767747,2019-04-17 00:20:09,0,0,0,Download N960U1UEU1CSC2 Galaxy Note 9 (SM-N960U1) SM-N960U1 ATT At&thttps://www.galaxyrom.com/firmware/download-n960u1ueu1csc2-galaxy-note-9-sm-n960u1-sm-n960u1-att-att-2.html …
1118308074442379270,2019-04-17 00:19:56,0,0,0,Download G570MUBS5CSD1 Galaxy J5 Prime (SM-G570M) SM-G570M PEO N/ahttps://www.galaxyrom.com/firmware/download-g570mubs5csd1-galaxy-j5-prime-sm-g570m-sm-g570m-peo-na.html …
1118308073741877248,2019-04-17 00:19:56,0,0,0,Download G570MUBS5CSD1 Galaxy J5 Prime (SM-G570M) SM-G570M COO N/a https://www.galaxyrom.com/firmware/download-g570mubs5csd1-galaxy-j5-prime-sm-g570m-sm-g570m-coo-na.html …
1118308071963541505,2019-04-17 00:19:56,0,0,0,Download G570MUBS5CSD1 Galaxy J5 Prime (SM-G570M) SM-G570M ARO Argentinahttps://www.galaxyrom.com/firmware/download-g570mubs5csd1-galaxy-j5-prime-sm-g570m-sm-g570m-aro-argentina.html …
1118308071279865856,2019-04-17 00:19:56,0,0,0,Download G570MUBS5CSD1 Galaxy J5 Prime (SM-G570M) SM-G570M EON N/a https://www.galaxyrom.com/firmware/download-g570mubs5csd1-galaxy-j5-prime-sm-g570m-sm-g570m-eon-na.html …
1118296476873048065,2019-04-16 23:33:51,0,0,0,Download G955FXXU4DSCB Galaxy S8 Plus SM-G955F OMN Italy (vodafone)https://www.galaxyrom.com/firmware/download-g955fxxu4dscb-galaxy-s8-plus-sm-g955f-omn-italy-vodafone.html …
1118296446812532738,2019-04-16 23:33:44,0,0,0,Download A530FXXU4CSC3 Galaxy A8 SM-A530F TPA Panamahttps://www.galaxyrom.com/firmware/download-a530fxxu4csc3-galaxy-a8-sm-a530f-tpa-panama.html …
1118296409541881856,2019-04-16 23:33:35,0,0,0,Download G930FXXS4ESC1 Galaxy S7 SM-G930F OPS Australia (optus)https://www.galaxyrom.com/firmware/download-g930fxxs4esc1-galaxy-s7-sm-g930f-ops-australia-optus.html …
1118296144155693059,2019-04-16 23:32:32,0,0,0,Download A530FXXU4CSCD Galaxy A8 SM-A530F TUN Tunisiahttps://www.galaxyrom.com/firmware/download-a530fxxu4cscd-galaxy-a8-sm-a530f-tun-tunisia.html …
1118293593293246465,2019-04-16 23:22:24,0,0,0,Download N960U1UEU1CSC2 Galaxy Note 9 (SM-N960U1) SM-N960U1 ATT At&t https://www.galaxyrom.com/firmware/download-n960u1ueu1csc2-galaxy-note-9-sm-n960u1-sm-n960u1-att-att.html …
1118293592836120576,2019-04-16 23:22:24,0,0,0,Download A500FUXXU1CSB1 Galaxy A5 (SM-A500FU) SM-A500FU ITV Italyhttps://www.galaxyrom.com/firmware/download-a500fuxxu1csb1-galaxy-a5-sm-a500fu-sm-a500fu-itv-italy.html …
1118293591380692993,2019-04-16 23:22:23,0,0,0,Download J701MUBU5BRK2 SM-J701M SM-J701M UFN Argentina (moviestar)https://www.galaxyrom.com/firmware/download-j701mubu5brk2-sm-j701m-sm-j701m-ufn-argentina-moviestar.html …
1118293591124783110,2019-04-16 23:22:23,0,0,0,Download A920FXXU1ASAA SM-A920F SM-A920F ORS Slovakiahttps://www.galaxyrom.com/firmware/download-a920fxxu1asaa-sm-a920f-sm-a920f-ors-slovakia.html …
1118293505871425536,2019-04-16 23:22:03,0,0,0,Download G965FXXS3CSD1 Galaxy S9 Plus (SM-G965F) SM-G965F COA Romania (cosmote)https://www.galaxyrom.com/firmware/download-g965fxxs3csd1-galaxy-s9-plus-sm-g965f-sm-g965f-coa-romania-cosmote.html …
1118293504315330561,2019-04-16 23:22:02,0,0,0,Download G570MUBS5CSD1 Galaxy J5 Prime (SM-G570M) SM-G570M MXO N/ahttps://www.galaxyrom.com/firmware/download-g570mubs5csd1-galaxy-j5-prime-sm-g570m-sm-g570m-mxo-na.html …
1118208007232479233,2019-04-16 17:42:18,7,4,1,"Am I the only not satisfied with the new Android update?

#samsungupdate #androidupdate pic.twitter.com/G8FpFRZFGK"
1118207543548022785,2019-04-16 17:40:28,0,0,0,New Shiny boost in Pokemon GO #android #androidupdate pic.twitter.com/iZvDWu85S7
1118206803580542976,2019-04-16 17:37:31,0,0,0,Download J810FJXS3ASC1 Galaxy J8 (SM-J810F) SM-J810F ECT Nigeriahttps://www.galaxyrom.com/firmware/download-j810fjxs3asc1-galaxy-j8-sm-j810f-sm-j810f-ect-nigeria.html …
1118206729106411521,2019-04-16 17:37:14,0,0,0,Download J730GDXS6BSD1 SM-J730G SM-J730G XXV Vietnamhttps://www.galaxyrom.com/firmware/download-j730gdxs6bsd1-sm-j730g-sm-j730g-xxv-vietnam.html …
1118206728208834562,2019-04-16 17:37:13,0,0,0,Download T713XXU2BSA1 SM-T713 SM-T713 SER Russiahttps://www.galaxyrom.com/firmware/download-t713xxu2bsa1-sm-t713-sm-t713-ser-russia.html …
1118206635397218305,2019-04-16 17:36:51,0,0,0,Download J730GDXS6BSD1 SM-J730G SM-J730G SMA Philippines (smart)https://www.galaxyrom.com/firmware/download-j730gdxs6bsd1-sm-j730g-sm-j730g-sma-philippines-smart.html …
1118206550873653250,2019-04-16 17:36:31,0,0,0,Download A520FXXU8CSB5 Galaxy A5 2017 (SM-A520F) SM-A520F CAM N/ahttps://www.galaxyrom.com/firmware/download-a520fxxu8csb5-galaxy-a5-2017-sm-a520f-sm-a520f-cam-na.html …
1118206544313757696,2019-04-16 17:36:30,0,0,0,Download J810FJXS3ASC1 Galaxy J8 (SM-J810F) SM-J810F XFE South africahttps://www.galaxyrom.com/firmware/download-j810fjxs3asc1-galaxy-j8-sm-j810f-sm-j810f-xfe-south-africa.html …
1118205530441486340,2019-04-16 17:32:28,0,0,0,Download G930FXXS4ESBB Galaxy S7 SM-G930F ZTM Brazil (tim)https://www.galaxyrom.com/firmware/download-g930fxxs4esbb-galaxy-s7-sm-g930f-ztm-brazil-tim.html …
1118204644562489344,2019-04-16 17:28:57,0,0,0,Download A720FXXS7CSC8 Galaxy A7 2017 (SM-A720F) SM-A720F SLK Sri lankahttps://www.galaxyrom.com/firmware/download-a720fxxs7csc8-galaxy-a7-2017-sm-a720f-sm-a720f-slk-sri-lanka.html …
1118204639743283202,2019-04-16 17:28:56,0,0,0,Download A720FXXS7CSC8 Galaxy A7 2017 (SM-A720F) SM-A720F NPL Nepalhttps://www.galaxyrom.com/firmware/download-a720fxxs7csc8-galaxy-a7-2017-sm-a720f-sm-a720f-npl-nepal.html …
1118204639369990145,2019-04-16 17:28:55,0,0,0,Download A520FXXU8CSC1 Galaxy A5 2017 (SM-A520F) SM-A520F H3G United kingdomhttps://www.galaxyrom.com/firmware/download-a520fxxu8csc1-galaxy-a5-2017-sm-a520f-sm-a520f-h3g-united-kingdom.html …
1118204638929539072,2019-04-16 17:28:55,0,0,0,Download G935FXXS4ESBB Galaxy S7 Edge SM-G935F ZTM Brazil (tim) https://www.galaxyrom.com/firmware/download-g935fxxs4esbb-galaxy-s7-edge-sm-g935f-ztm-brazil-tim.html …
1118187421810790400,2019-04-16 16:20:30,1,0,0,"OPPO F11 Pro Review : Thunder Black, from good to great #android #androidupdate pic.twitter.com/ApYEcpQSJs"
1118149650232614912,2019-04-16 13:50:25,0,0,0,Download T825XXU3BSD1 Galaxy Tab S3 (LTE) SM-T825 BTU United kingdomhttps://www.galaxyrom.com/firmware/download-t825xxu3bsd1-galaxy-tab-s3-lte-sm-t825-btu-united-kingdom.html …
1118149649842495490,2019-04-16 13:50:25,0,0,0,Download J415FNXXU2ASC1 SM-J415FN SM-J415FN BTU United kingdomhttps://www.galaxyrom.com/firmware/download-j415fnxxu2asc1-sm-j415fn-sm-j415fn-btu-united-kingdom.html …
1118149647573372934,2019-04-16 13:50:24,0,0,0,Download J400MUBS3ASD3 SM-J400M SM-J400M BVO N/ahttps://www.galaxyrom.com/firmware/download-j400mubs3asd3-sm-j400m-sm-j400m-bvo-na.html …
1118149646214471680,2019-04-16 13:50:24,0,0,0,Download J400MUBS3ASD3 SM-J400M SM-J400M EON N/a https://www.galaxyrom.com/firmware/download-j400mubs3asd3-sm-j400m-sm-j400m-eon-na.html …
1118149646214402049,2019-04-16 13:50:24,0,0,0,Download G570MUBS5CSD1 Galaxy J5 Prime (SM-G570M) SM-G570M TTT Trinidad and tobagohttps://www.galaxyrom.com/firmware/download-g570mubs5csd1-galaxy-j5-prime-sm-g570m-sm-g570m-ttt-trinidad-and-tobago.html …
1118149644553527296,2019-04-16 13:50:24,0,0,0,Download J730GDXS6BSD1 SM-J730G SM-J730G XSA Australiahttps://www.galaxyrom.com/firmware/download-j730gdxs6bsd1-sm-j730g-sm-j730g-xsa-australia.html …
1118149525808517120,2019-04-16 13:49:55,0,0,0,Download J400MUBS3ASD3 SM-J400M SM-J400M ZTO Brazilhttps://www.galaxyrom.com/firmware/download-j400mubs3asd3-sm-j400m-sm-j400m-zto-brazil.html …
1118149508590919680,2019-04-16 13:49:51,0,0,0,Download G935FXXS4ESC1 Galaxy S7 Edge SM-G935F OPS Australia (optus)https://www.galaxyrom.com/firmware/download-g935fxxs4esc1-galaxy-s7-edge-sm-g935f-ops-australia-optus.html …
1118149506757996547,2019-04-16 13:49:51,0,0,0,Download J400MUBS3ASD3 SM-J400M SM-J400M TPA Panamahttps://www.galaxyrom.com/firmware/download-j400mubs3asd3-sm-j400m-sm-j400m-tpa-panama.html …
1118149499560423424,2019-04-16 13:49:49,0,0,0,Download G611MUBS3BSC3 SM-G611M SM-G611M CGU Colombiahttps://www.galaxyrom.com/firmware/download-g611mubs3bsc3-sm-g611m-sm-g611m-cgu-colombia.html …
1118149437501726738,2019-04-16 13:49:34,0,0,0,Download G950FXXU4DSCB Galaxy S8 SM-G950F 3IE Ireland (three)https://www.galaxyrom.com/firmware/download-g950fxxu4dscb-galaxy-s8-sm-g950f-3ie-ireland-three.html …
1118149434309775362,2019-04-16 13:49:34,0,0,0,Download G530HXXS2BSB1 Galaxy Grand Prime (Dual Sim) SM-G530H CHE Chile (entel pcs)https://www.galaxyrom.com/firmware/download-g530hxxs2bsb1-galaxy-grand-prime-dual-sim-sm-g530h-che-chile-entel-pcs.html …
1118149433986834433,2019-04-16 13:49:33,0,0,0,Download G960FXXU3CSD4 Galaxy S9 (SM-G960F) SM-G960F PHN Netherlandshttps://www.galaxyrom.com/firmware/download-g960fxxu3csd4-galaxy-s9-sm-g960f-sm-g960f-phn-netherlands.html …
1118021102805102592,2019-04-16 05:19:37,0,0,0,Download A600PVPU2BSC8 SM-A600P SM-A600P VMU N/ahttps://www.galaxyrom.com/firmware/download-a600pvpu2bsc8-sm-a600p-sm-a600p-vmu-na.html …
1118021024065490944,2019-04-16 05:19:18,0,0,0,Download N960U1UEU1CSC2 Galaxy Note 9 (SM-N960U1) SM-N960U1 XAA N/ahttps://www.galaxyrom.com/firmware/download-n960u1ueu1csc2-galaxy-note-9-sm-n960u1-sm-n960u1-xaa-na.html …
1118021023411183616,2019-04-16 05:19:18,0,0,0,Download A530FXXU4CSCD Galaxy A8 SM-A530F ILO Israelhttps://www.galaxyrom.com/firmware/download-a530fxxu4cscd-galaxy-a8-sm-a530f-ilo-israel.html …
1118018017458364416,2019-04-16 05:07:21,0,0,0,Download N960U1UEU1CSC2 Galaxy Note 9 (SM-N960U1) SM-N960U1 TMB Usa (t-mobile)https://www.galaxyrom.com/firmware/download-n960u1ueu1csc2-galaxy-note-9-sm-n960u1-sm-n960u1-tmb-usa-t-mobile.html …
1118018009023549441,2019-04-16 05:07:19,0,0,0,Download A750GUBU2BSC7 SM-A750G SM-A750G ARO Argentinahttps://www.galaxyrom.com/firmware/download-a750gubu2bsc7-sm-a750g-sm-a750g-aro-argentina.html …
1118018000957923328,2019-04-16 05:07:17,0,0,0,Download A530FXXU4CSCD Galaxy A8 SM-A530F MAT Morocco (mat)https://www.galaxyrom.com/firmware/download-a530fxxu4cscd-galaxy-a8-sm-a530f-mat-morocco-mat.html …
1118017886444855296,2019-04-16 05:06:50,0,0,0,Download J530FXXU4BSC2 Galaxy J5 2017 SM-J530F ROM Romaniahttps://www.galaxyrom.com/firmware/download-j530fxxu4bsc2-galaxy-j5-2017-sm-j530f-rom-romania.html …
1118017875711799296,2019-04-16 05:06:47,0,0,0,Download G955FXXU4DSBA Galaxy S8 Plus SM-G955F COB Colombia (movistar)https://www.galaxyrom.com/firmware/download-g955fxxu4dsba-galaxy-s8-plus-sm-g955f-cob-colombia-movistar.html …
1118017872578658304,2019-04-16 05:06:47,0,0,0,Download A730FXXU4CSCH Galaxy A8 Plus SM-A730F BTC Libyahttps://www.galaxyrom.com/firmware/download-a730fxxu4csch-galaxy-a8-plus-sm-a730f-btc-libya.html …
1118017871647576065,2019-04-16 05:06:47,0,0,0,Download A500FUXXU1CSB1 Galaxy A5 (SM-A500FU) SM-A500FU LUX Luxemburghttps://www.galaxyrom.com/firmware/download-a500fuxxu1csb1-galaxy-a5-sm-a500fu-sm-a500fu-lux-luxemburg.html …
1118017850050875392,2019-04-16 05:06:41,0,0,0,Download A730FXXU4CSCH Galaxy A8 Plus SM-A730F AFG Afghanistanhttps://www.galaxyrom.com/firmware/download-a730fxxu4csch-galaxy-a8-plus-sm-a730f-afg-afghanistan.html …
1118017781004423168,2019-04-16 05:06:25,0,0,0,Download A530FXXU4CSD4 Galaxy A8 SM-A530F SER Russiahttps://www.galaxyrom.com/firmware/download-a530fxxu4csd4-galaxy-a8-sm-a530f-ser-russia.html …
1118017778471063552,2019-04-16 05:06:24,0,0,0,Download G955FXXU4DSCB Galaxy S8 Plus SM-G955F MOB Austria (a1)https://www.galaxyrom.com/firmware/download-g955fxxu4dscb-galaxy-s8-plus-sm-g955f-mob-austria-a1.html …
1118017778399817728,2019-04-16 05:06:24,0,0,0,Download G965FXXU3CSD4 Galaxy S9 Plus (SM-G965F) SM-G965F PHN Netherlandshttps://www.galaxyrom.com/firmware/download-g965fxxu3csd4-galaxy-s9-plus-sm-g965f-sm-g965f-phn-netherlands.html …
1118017778332708866,2019-04-16 05:06:24,0,0,0,Download T819XXU2BSA1 Galaxy Tab S2 VE 9.7 LTE SM-T819 SER Russiahttps://www.galaxyrom.com/firmware/download-t819xxu2bsa1-galaxy-tab-s2-ve-9-7-lte-sm-t819-ser-russia.html …
1118017656790106112,2019-04-16 05:05:55,0,0,0,Download G955FXXU4DSCB Galaxy S8 Plus SM-G955F ATL Spain (vodafone)https://www.galaxyrom.com/firmware/download-g955fxxu4dscb-galaxy-s8-plus-sm-g955f-atl-spain-vodafone.html …
1118017655565365248,2019-04-16 05:05:55,0,0,0,Download G950FXXU4DSCB Galaxy S8 SM-G950F MOB Austria (a1) https://www.galaxyrom.com/firmware/download-g950fxxu4dscb-galaxy-s8-sm-g950f-mob-austria-a1.html …
1117880384790773765,2019-04-15 20:00:27,0,0,0,"After Smartphones, you’ll need an Expander #android #androidupdate pic.twitter.com/AOWLMcQpIV"
